{
  "kind": "tpr.handoff",
  "schema_version": "1",
  "id": "sk.h.20260504T080926-fixt1",
  "in_reply_to": "sk.i.20260504T080926-fixt1",
  "from_agent": "3OX.Sidekik",
  "to_agent": "money_bagz",
  "subagent_path": "Money.Bagz",
  "topics_hint": ["bills", "budget", "income", "due"],
  "classified_key": "bills",
  "text": "pay the electric bill",
  "created_at": "2026-05-04T08:09:26Z",
  "consumer": "TelePromptR",
  "merge_via": "TelePromptR/<TPR_ZENS3N>/merge.sh",
  "speaker_unit": "speaker-mesh.service"
}
